title, author, genre, # pages, rating, # ratings, progress
A Fire Upon the Deep (Zones of Thought #1), Vernor Vinge, Science Fiction, 613, 4.13, 31909, 
A Suitable Boy (A Suitable Boy #1), Vikram Seth, Fiction, 1474, 4.08, 30366, 
A Wizard of Earthsea (Earthsea Cycle #1), Ursula K. Le Guin, Fantasy, 183, 3.97, 134553, 
Age of Ambition: Chasing Fortune Truth and Faith in the New China, Evan Osnos, Cultural, 403, 4.22, 2089, 
Amnesia, Peter Carey, Fiction, 311, 2.81, 1142, 
Among Others, Jo Walton, Fantasy, 302, 3.68, 14245, 
Angler: The Cheney Vice Presidency, Barton Gellman, Politics, 384, 4.04, 1024, 
Anna Karenina, Leo Tolstoy, Classics, 964, 4.0, 372698, 
Atlas Shrugged, Ayn Rand, Fiction, 1168, 3.67, 250077, 
Average Is Over: Powering America Beyond the Age of the Great Stagnation, Tyler Cowen, Economics, 304, 3.57, 877, 
Bleeding Edge, Thomas Pynchon, Fiction, 477, 3.55, 6638, 
Body of Secrets: Anatomy of the Ultra-Secret National Security Agency from the Cold War Through the Dawn of a New Century, James Bamford, History, 784, 3.89, 1175, 
The Shadow of the Torturer (The Book of the New Sun #1), Gene Wolfe, Fantasy, 262, 3.81, 13077, 
Book of Numbers, Joshua Cohen, Fiction, 580, 2.92, 361, 
Born Standing Up: A Comic's Life, Steve Martin, Non Fiction, 207, 3.86, 50516, 
Brain Maker: The Power of Gut Microbes to Heal and Protect Your Brain–for Life, David  Perlmutter, Health, 320, 4.1, 1007, 
Business @ the Speed of Thought: Succeeding in the Digital Economy, Bill Gates, Business, 496, 3.72, 2304, 
By Night in Chile, Roberto Bolaño, Fiction, 118, 3.88, 4744, 
Chaos: Making a New Science, James Gleick, Science, 352, 3.96, 19753, 
Cloud Atlas, David Mitchell, Science Fiction, 509, 4.01, 141939, 
Collapse: How Societies Choose to Fail or Succeed, Jared Diamond, Non Fiction, 608, 3.91, 42008, 
Confront and Conceal: Obama's Secret Wars and Surprising Use of American Power, David E. Sanger, Politics, 496, 3.95, 723, 
Conscious Capitalism: Liberating the Heroic Spirit of Business, John E. Mackey, Business, 368, 3.81, 818, 
Contact, Carl Sagan, Science Fiction, 580, 4.07, 77854, 
Corporate Warriors: The Rise of the Privatized Military Industry (Cornell Studies in Security Affairs), P.W. Singer, Non Fiction, 330, 3.94, 319, 
Cosmos, Carl Sagan, Science, 384, 4.35, 58153, 
Cybersecurity and Cyberwar, P.W. Singer, Non Fiction, 306, 3.84, 237, 
Deliverance, James Dickey, Fiction, 288, 3.85, 22289, 
Dhalgren, Samuel R. Delany, Science Fiction, 801, 3.81, 5426, 
Different Seasons, Stephen King, Horror, 560, 4.32, 114869, 
The Color of Magic (Discworld #1), Terry Pratchett, Fantasy, 228, 3.94, 172874, 
Do No Harm: Stories of Life Death and Brain Surgery, Henry Marsh, Non Fiction, 278, 4.19, 3869, 
Don Quixote (Don Quixote #1-2), Miguel de Cervantes Saavedra, Classics, 982, 3.84, 130530, 
The Dragonriders of Pern (Dragonriders of Pern #1-3), Anne McCaffrey, Fantasy, 832, 4.19, 19201, 
Egghead: Or You Can't Survive on Ideas Alone, Bo Burnham, Poetry, 240, 4.11, 4223, 
Everything and More: A Compact History of Infinity (Great Discoveries), David Foster Wallace, Non Fiction, 336, 3.68, 2381, 
Everything's Eventual: 14 Dark Tales, Stephen King, Horror, 583, 3.91, 55578, 
Fall of Giants (The Century Trilogy #1), Ken Follett, Historical Fiction, 985, 4.22, 142972, 
Fermat's Enigma: The Epic Quest to Solve the World's Greatest Mathematical Problem, Simon Singh, Non Fiction, 315, 4.19, 14975, 
Generation X: Tales for an Accelerated Culture, Douglas Coupland, Fiction, 211, 3.73, 20107, 
Genome: the Autobiography of a Species in 23 Chapters, Matt Ridley, Science, 344, 4.0, 14907, 
Girl with Curious Hair, David Foster Wallace, Fiction, 373, 3.89, 8224, 
Hacking: The Art of Exploitation, Jon Erickson, Science, 241, 4.18, 974, 
Ham on Rye, Charles Bukowski, Classics, 288, 4.16, 49212, 
Have a Nice Day!: A Tale of Blood and Sweatsocks, Mick Foley, Non Fiction, 768, 4.29, 5082, 
The Subtle Knife (His Dark Materials #2), Philip Pullman, Fantasy, 326, 4.09, 222712, 
A History of Western Philosophy, Bertrand Russell, History, 895, 4.04, 18112, 
How Markets Fail: The Logic of Economic Calamities, John Cassidy, Economics, 400, 4.01, 1399, 
How to Change the World: Social Entrepreneurs and the Power of New Ideas, David Bornstein, Business, 320, 3.92, 1378, 
Imhotep (Imhotep #1), Jerry Dubs, Historical Fiction, 693, 3.8, 781, 
Infections and Inequalities: The Modern Plagues, Paul Farmer, Non Fiction, 419, 4.09, 1961, 
Ishmael: An Adventure of the Mind and Spirit (Ishmael #1), Daniel Quinn, Fiction, 263, 3.95, 56952, 
Jonathan Strange & Mr Norrell, Susanna Clarke, Fantasy, 1006, 3.77, 121242, 
Kingpin: How One Hacker Took Over the Billion-Dollar Cybercrime Underground, Kevin Poulsen, Non Fiction, 288, 4.01, 2815, 
Last and First Men/Star Maker, Olaf Stapledon, Science Fiction, 438, 3.95, 422, 
Leaves of Grass, Walt Whitman, Poetry, 624, 4.13, 57618, 
Walden: And Civil Disobedience. Henry David Thoreau (Classic Masterpiece Series ), Henry David Thoreau, Non Fiction, 432, 3.97, 24102, 
Lolita, Vladimir Nabokov, Literature, 378, 3.87, 440098, 
Macbeth, William Shakespeare, Classics, 249, 3.87, 436786, 
Mating in Captivity: Reconciling the Erotic + the Domestic, Esther Perel, Non Fiction, 244, 3.93, 2419, 
Men are from Mars Women are from Venus - A Guide for Improving Communication and Getting What You Want in Your Relationships, John  Gray, Self Help, , 3.49, 109517, 
Moby-Dick; or The Whale, Herman Melville, Classics, 663, 3.43, 345837, 
My Years with General Motors, Alfred P. Sloan Jr., Business, 496, 3.85, 315, 
Never Let Me Go, Kazuo Ishiguro, Fiction, 288, 3.79, 258251, 
No Good Men Among the Living: America the Taliban and the War through Afghan Eyes, Anand Gopal, Non Fiction, 304, 4.42, 616, 
Notes from Underground, Fyodor Dostoyevsky, Novels, 233, 4.15, 79204, 
The Odyssey, Homer, Classics, 560, 3.7, 622741, 
Oryx and Crake (MaddAddam #1), Margaret Atwood, Fiction, 374, 3.98, 130641, 
Our Final Invention: Artificial Intelligence and the End of the Human Era, James Barrat, Science, 336, 3.67, 798, 
Pale Blue Dot: A Vision of the Human Future in Space, Carl Sagan, Science, 384, 4.3, 16015, 
Parallel Worlds: A Journey Through Creation Higher Dimensions and the Future of the Cosmos, Michio Kaku, Science, 448, 4.16, 10427, 
Perdido Street Station (New Crobuzon #1), China Miéville, Fantasy, 623, 3.95, 38225, 
Permanent Midnight, Jerry Stahl, Non Fiction, 371, 3.96, 1169, 
Pour Your Heart Into It: How Starbucks Built a Company One Cup at a Time, Howard Schultz, Non Fiction, 351, 3.95, 3752, 
Red Mars (Mars Trilogy #1), Kim Stanley Robinson, Science Fiction, 572, 3.82, 38543, 
Redeployment, Phil Klay, Short Stories, 288, 3.99, 12951, 
Rendezvous with Rama (Rama #1), Arthur C. Clarke, Science Fiction, 243, 4.03, 82533, 
Ringworld (Ringworld #1), Larry Niven, Science Fiction, 288, 3.95, 66296, 
Rise of the Robots: Technology and the Threat of a Jobless Future, Martin Ford, Non Fiction, 352, 4.04, 416, 
Robinson Crusoe, Daniel Defoe, Classics, 320, 3.65, 162287, 
Sandman Slim (Sandman Slim #1), Richard Kadrey, Fantasy, 388, 3.93, 21444, 
The Silence of the Lambs (Hannibal Lecter #2), Thomas Harris, Horror, 338, 4.09, 314186, 
Singled Out: How Singles Are Stereotyped Stigmatized and Ignored and Still Live Happily Ever After, Bella DePaulo, Non Fiction, 336, 3.66, 296, 
The Sirens of Titan, Kurt Vonnegut, Science Fiction, 224, 4.14, 66320, 
So Good They Can't Ignore You: Why Skills Trump Passion in the Quest for Work You Love, Cal Newport, Non Fiction, 288, 4.0, 4896, 
Something Wicked This Way Comes (Green Town #2), Ray Bradbury, Horror, 293, 3.95, 59534, 
Sophie's World, Jostein Gaarder, Philosophy, 403, 3.85, 114423, 
Spam Nation: The Inside Story of Organized Cybercrime — from Global Epidemic to Your Front Door, Brian Krebs, Non Fiction, 256, 3.64, 704, 
Spycraft: The Secret History of the CIA's Spytechs from Communism to al-Qaeda, Robert Wallace, Non Fiction, 576, 3.81, 699, 
Starship Troopers, Robert A. Heinlein, Science Fiction, 264, 3.98, 114924, 
Steppenwolf, Hermann Hesse, Fiction, 256, 4.09, 76259, 
Stranger in a Strange Land, Robert A. Heinlein, Science Fiction, 528, 3.88, 195907, 
Superintelligence: Paths Dangers Strategies, Nick Bostrom, Science, 328, 3.87, 1743, 
Swan Song, Robert McCammon, Horror, 956, 4.28, 33473, 
Tales of the Unexpected (Roald Dahl's Tales of the Unexpected #1), Roald Dahl, Short Stories, 471, 4.16, 6126, 
The Alienist (Dr. Laszlo Kreizler #1), Caleb Carr, Mystery, 498, 4.04, 85573, 
The Autobiography of Malcolm X, Malcolm X, Non Fiction, 466, 4.27, 91487, 
The Barbary Coast: An Informal History of the San Francisco Underworld, Herbert Asbury, Non Fiction, 336, 3.88, 456, 
Quicksilver (The Baroque Cycle #1), Neal Stephenson, Fiction, 927, 3.91, 26556, 
The Botany of Desire: A Plant's-Eye View of the World, Michael Pollan, Non Fiction, 297, 4.04, 33109, 
The Brothers Karamazov, Fyodor Dostoyevsky, Classics, 796, 4.29, 144089, 
The Burning Room (Harry Bosch #19), Michael Connelly, Mystery, 388, 4.0, 18295, 
The Chrysalids, John Wyndham, Science Fiction, 200, 3.91, 26876, 
The Circle, Dave Eggers, Science Fiction, 508, 3.43, 67492, 
The Collapse of Complex Societies, Joseph A. Tainter, History, 262, 4.14, 464, 
The Communist Manifesto, Karl Marx, Non Fiction, 304, 3.48, 54779, 
The Corpse Reader, Antonio Garrido, Historical Fiction, 494, 3.8, 1719, 
The Count of Monte Cristo, Alexandre Dumas, Classics, 1276, 4.18, 507524, 
The Road to the Dark Tower: Exploring Stephen King's Magnum Opus, Bev Vincent, Fantasy, 368, 4.27, 27676, 
The Death of Common Sense: How Law Is Suffocating America, Philip K. Howard, Non Fiction, 213, 3.85, 778, 
The Demon-Haunted World: Science as a Candle in the Dark, Carl Sagan, Science, 457, 4.27, 35428, 
The Department of Mad Scientists: How DARPA Is Remaking Our World from the Internet to Artificial Limbs, Michael Belfiore, Non Fiction, 320, 3.5, 269, 
The Devil in the White City: Murder Magic and Madness at the Fair that Changed America, Erik Larson, Non Fiction, 447, 3.97, 286752, 
The Dispossessed (Hainish Cycle), Ursula K. Le Guin, Science Fiction, 387, 4.16, 38879, 
The Drunkard's Walk: How Randomness Rules Our Lives, Leonard Mlodinow, Non Fiction, 252, 3.86, 11665, 
The Everything Store: Jeff Bezos and the Age of Amazon, Brad Stone, Business, 341, 3.93, 12056, 
The Faith Healers, James Randi, Non Fiction, 328, 4.19, 516, 
The Forever War, Dexter Filkins, Non Fiction, 342, 4.16, 6317, 
The Forever War (The Forever War #1), Joe Haldeman, Science Fiction, 278, 4.13, 80739, 
The Fountainhead, Ayn Rand, Fiction, 720, 3.83, 223814, 
The Geography of Nowhere: The Rise and Decline of America's Man-Made Landscape, James Howard Kunstler, Non Fiction, 304, 4.05, 2376, 
The Ghost Map: The Story of London's Most Terrifying Epidemic - and How It Changed Science Cities and the Modern World, Steven Johnson, History, 299, 3.9, 21554, 
The Girl Next Door, Jack Ketchum, Horror, 370, 3.96, 12237, 
The Grand Design, Stephen Hawking, Science, 199, 3.98, 35003, 
The Gulag Archipelago 1918-1956 (The Gulag Archipelago 1918-1956 #1-7), Aleksandr Solzhenitsyn, History, 512, 4.13, 10665, 
The Handmaid's Tale, Margaret Atwood, Fiction, 311, 4.0, 445572, 
The Hard Thing About Hard Things: Building a Business When There Are No Easy Answers, Ben Horowitz, Business, 304, 4.13, 9513, 
The Hero With a Thousand Faces, Joseph Campbell, Non Fiction, 416, 4.25, 16745, 
The Hot Zone: The Terrifying True Story of the Origins of the Ebola Virus, Richard   Preston, Non Fiction, 323, 4.08, 63334, 
Hyperion (Hyperion Cantos #1), Dan Simmons, Science Fiction, 483, 4.18, 99089, 
The Illuminatus! Trilogy: The Eye in the Pyramid/The Golden Apple/Leviathan (Illuminatus! #1-3), Robert Shea, Fiction, 805, 3.99, 11845, 
The Innovators: How a Group of Hackers Geniuses and Geeks Created the Digital Revolution, Walter Isaacson, Non Fiction, 528, 3.96, 10296, 
The Last Unicorn (The Last Unicorn #1), Peter S. Beagle, Fantasy, 294, 4.17, 71080, 
The Lean Startup: How Today's Entrepreneurs Use Continuous Innovation to Create Radically Successful Businesses, Eric Ries, Business, 299, 4.01, 39078, 
The Long Tomorrow, Leigh Brackett, Science Fiction, 223, 3.59, 1041, 
The Master and Margarita, Mikhail Bulgakov, Fiction, 360, 4.32, 116968, 
The Master Switch: The Rise and Fall of Information Empires, Tim Wu, Non Fiction, 384, 3.98, 3165, 
The Mists of Avalon (Avalon #1), Marion Zimmer Bradley, Fantasy, 876, 4.1, 143084, 
The Mote in God's Eye (Moties #1), Larry Niven, Science Fiction, 596, 4.05, 44700, 
The Obstacle Is the Way: The Timeless Art of Turning Trials into Triumph, Ryan Holiday, Non Fiction, 224, 4.0, 5449, 
The Once and Future King (The Once and Future King #1-4), T.H. White, Fantasy, 639, 4.07, 74125, 
The Painted Bird, Jerzy Kosiński, Fiction, 234, 3.94, 13082, 
The Panda's Thumb: More Reflections in Natural History (Reflections in Natural History #2), Stephen Jay Gould, Science, 352, 4.1, 4369, 
The Power of Myth (Joseph Campbell and Power of Myth), Joseph Campbell, Non Fiction, 320, 4.29, 28509, 
The Darkness That Comes Before (The Prince of Nothing #1), R. Scott Bakker, Fiction, 608, 3.76, 11791, 
The Promise of a Pencil: How an Ordinary Person Can Create Extraordinary Change, Adam Braun, Non Fiction, 272, 4.07, 2357, 
The Rational Optimist: How Prosperity Evolves, Matt Ridley, Non Fiction, 448, 3.96, 3883, 
The Restaurant at the End of the Universe (Hitchhiker's Guide to the Galaxy #2), Douglas Adams, Science Fiction, 250, 4.2, 132978, 
The Road to Reality: A Complete Guide to the Laws of the Universe, Roger Penrose, Science, 1099, 4.05, 4127, 
The Scar (New Crobuzon #2), China Miéville, Fantasy, 578, 4.14, 19465, 
The Secret Sentry: The Untold History of the National Security Agency, Matthew M. Aid, History, 432, 3.51, 223, 
The Singularity is Near: When Humans Transcend Biology, Ray Kurzweil, Science, 652, 3.91, 5807, 
The Sixth Extinction: An Unnatural History, Elizabeth Kolbert, Non Fiction, 319, 4.03, 12802, 
The Snowden Files: The Inside Story of the World's Most Wanted Man, Luke Harding, Non Fiction, 333, 3.94, 1352, 
The Sound and the Fury, William Faulkner, Classics, 326, 3.85, 113615, 
The Stand, Stephen King, Horror, 1153, 4.32, 382006, 
The Stars My Destination, Alfred Bester, Science Fiction, 258, 4.14, 26536, 
The Three-Body Problem (Three Body #1), Liu Cixin, Science Fiction, 400, 4.0, 9533, 
The Eye of the World (The Wheel of Time #1), Robert Jordan, Fantasy, 800, 4.16, 208177, 
The Wisdom of Crowds, James Surowiecki, Non Fiction, 306, 3.78, 15358, 
Their Eyes Were Watching God, Zora Neale Hurston, Classics, 256, 3.84, 163958, 
Thinking Fast and Slow, Daniel Kahneman, Psychology, 499, 4.03, 90823, 
The Third Chimpanzee: The Evolution & Future of the Human Animal, Jared Diamond, Science, 407, 4.02, 13072, 
This Machine Kills Secrets: How WikiLeakers Cypherpunks and Hacktivists Aim to Free the World's Informatio n, Andy Greenberg, Non Fiction, 384, 4.04, 560, 
This Will Change Everything: Ideas That Will Shape the Future, John Brockman, Science, 390, 3.64, 391, 
Titus Groan (Gormenghast #1), Mervyn Peake, Fantasy, 396, 3.9, 9393, 
Too Big to Fail: The Inside Story of How Wall Street and Washington Fought to Save the Financial System from Crisis — and Themselves, Andrew Ross Sorkin, Non Fiction, 600, 4.04, 21138, 
Tropic of Cancer, Henry Miller, Fiction, 318, 3.71, 41436, 
Twenty Thousand Leagues Under the Sea (Captain Nemo #1), Jules Verne, Classics, 394, 3.83, 111236, 
Ubik, Philip K. Dick, Science Fiction, 288, 4.09, 43253, 
Ulysses, James Joyce, Classics, 810, 3.73, 71219, 
Unbroken: A World War II Story of Survival Resilience and Redemption, Laura Hillenbrand, Non Fiction, 473, 4.44, 360327, 
Violent Python: A Cookbook for Hackers Forensic Analysts Penetration Testers and Security Engineers, T.J. O'Connor, Non Fiction, 288, 4.06, 202, 
Walden, Henry David Thoreau, Classics, 384, 3.79, 98479, 
Walking the Amazon: 860 Days. The Impossible Task. The Incredible Journey, Ed Stafford, Travel, 320, 3.65, 900, 
War and Peace, Leo Tolstoy, Classics, 1392, 4.1, 144673, 
Watership Down (Watership Down #1), Richard Adams, Classics, 481, 4.03, 259018, 
We Have Always Lived in the Castle, Shirley Jackson, Horror, 146, 4.06, 29987, 
The Wealth of Nations, Adam Smith, Economics, 1264, 3.84, 16465, 
What If?: Serious Scientific Answers to Absurd Hypothetical Questions, Randall Munroe, Non Fiction, 303, 4.14, 34080, 
When the Killing's Done, T.C. Boyle, Fiction, 384, 3.59, 3508, 
Winning (Winning #1), Jack Welch, Business, 384, 3.77, 26184, 
Women, Charles Bukowski, Fiction, 291, 3.91, 36031, 
